{
  "run_id": "561422-a1-20260722",
  "naics": "561422",
  "reviewer_model_id": "gpt-5.6-sol",
  "review_date": "2026-07-22",
  "methodology_version": "5.0",
  "outcome": "publishable_with_caveats",
  "mechanics": {
    "identity_ok": true,
    "score_reproduces": true,
    "memo_reproduces": true,
    "artifacts_sha256": "55c15a9ff583eef4b2640494c4ecb5fb8fcd20d897ed8b76cd60a7fd9cca9f4a"
  },
  "sources_audited": [
    {
      "source_id": "S1",
      "reachable": true,
      "support": "partially_supported",
      "note": "The Census URL is reachable and is the official 2022 NAICS search interface, but its reopened static response did not expose the 561422 result or definition. Census's official 2022 manual independently confirms the code and title, so the classification context is credible but the cited page is weak direct support."
    },
    {
      "source_id": "S2",
      "reachable": true,
      "support": "supported",
      "note": "The BLS page reports 2,814,000 customer-service-representative jobs in 2024, 2,660,300 projected for 2034, a 5% decline, the cited duties and call-center context, and increasing automation of simple tasks while complex inquiries persist."
    },
    {
      "source_id": "S3",
      "reachable": true,
      "support": "supported",
      "note": "The O*NET task list supports the cited customer-service duties, including records, inquiries, billing, complaint resolution, account-related actions, and solicitation of additional sales."
    },
    {
      "source_id": "S4",
      "reachable": true,
      "support": "supported",
      "note": "The SEC-filed TTEC 2024 Form 10-K states that most inbound and outbound BPO contracts charge per minute, hour, FTE, transaction, or call, exactly supporting the stated comparable billing bases."
    },
    {
      "source_id": "S5",
      "reachable": true,
      "support": "supported",
      "note": "The FTC guidance supports the cited telemarketing disclosure, express-consent, do-not-call, recordkeeping, and civil-penalty requirements. Its use as context for implementation constraints is reasonable, while the packet correctly treats implementation and operator-required-share values as estimates."
    },
    {
      "source_id": "S6",
      "reachable": true,
      "support": "supported",
      "note": "The Census SUSB page states that the annual data cover firms, establishments, employment, payroll, and receipts by industry and enterprise size and links six-digit NAICS tables, supporting the claimed availability and coverage."
    }
  ],
  "material_findings": [],
  "caveats": [
    "The declared lens combines inbound care, outbound sales, collections, appointments, and order programs despite the packet itself acknowledging sharply different substitution and regulatory paths; marking heterogeneous=false understates that mix risk, although the record's ranges and caveats disclose much of it and no supported correction is shown to change the CONDITIONAL base tier or VALIDATE_ASSUMPTIONS action.",
    "The q rationale invokes fewer billable units after automation while d5/o already capture surviving service quantity and operator-required share. This creates a potential boundary overlap between value capture and demand/substitution, but the evidence does not establish a corrected q that would cross the base-tier threshold, so it does not satisfy the literal materiality test.",
    "The e rationale partly discounts firms outside the EBITDA band even though injected n is defined as the LMM-band firm count. Given n's class-average construction this may compensate for anchor imprecision, but the distinction should be explicit to avoid apparent double counting; removing that discount alone would not change the base tier or action.",
    "The record is necessarily estimate-heavy: a, rho, e, s5, q, and o are bounded judgments, and d5 is an occupation-employment proxy for industry service quantity. The broad LOW_PRIORITY-to-HIGHEST_PRIORITY interval, MODEL_CONDITIONED readiness, and VALIDATE_ASSUMPTIONS action appropriately communicate that limitation."
  ],
  "summary": "Publishable with caveats. Mechanics pass, S2-S6 substantively support their stated factual uses, S1 is an official but weakly resolved direct citation, and the packet is candid about the estimates and proxy driving the score. Lens heterogeneity and possible q-versus-D and e-versus-n boundary overlap merit diligence, but none is demonstrated to change the CONDITIONAL base tier or VALIDATE_ASSUMPTIONS action under the brief's literal materiality rule."
}
