{
  "run_id": "541199-a1-20260722",
  "naics": "541199",
  "reviewer_model_id": "gpt-5.6-sol",
  "review_date": "2026-07-22",
  "methodology_version": "5.0",
  "outcome": "publishable_with_caveats",
  "mechanics": {
    "identity_ok": true,
    "score_reproduces": true,
    "memo_reproduces": true,
    "artifacts_sha256": "359d884faf0a8e1c473b3ad9159fc3c833fc4249bf2d0e9b107084c9ff077b39"
  },
  "sources_audited": [
    {
      "source_id": "S1",
      "reachable": true,
      "support": "supported",
      "note": "The Census definition identifies 541199 as specialized legal or paralegal services and lists notary public, paralegal, patent-agent, and process-serving services; it also separates lawyer offices and title/settlement activities as stated."
    },
    {
      "source_id": "S2",
      "reachable": true,
      "support": "supported",
      "note": "BLS lists research, document organization, drafting, filing, and coordination tasks and states that AI may raise efficiency and reduce demand for paralegals and legal assistants."
    },
    {
      "source_id": "S3",
      "reachable": true,
      "support": "supported",
      "note": "USPTO states that registered patent attorneys and agents may prepare and prosecute patent applications, that unrecognized persons cannot represent inventors before the agency, and that patent agents face practice limits."
    },
    {
      "source_id": "S4",
      "reachable": true,
      "support": "supported",
      "note": "ABA Formal Opinion 512 identifies the cited AI-assisted legal tasks and the continuing duties involving competence, confidentiality, supervision, verification, accuracy, and reasonable fees."
    },
    {
      "source_id": "S5",
      "reachable": true,
      "support": "supported",
      "note": "The Thomson Reuters report states that 40% of respondents expect alternative fee arrangements to increase because of GenAI, while also reporting substantial expectations that existing pricing will persist."
    },
    {
      "source_id": "S6",
      "reachable": true,
      "support": "partially_supported",
      "note": "BLS Table 2.11 supports the 541100 real-output values of 348.5 for 2024 and 408.9 for 2034 used in the d5 bridge. It does not support the separately attributed claim that the ABA describes client pressure for alternatives to hourly billing in the q rationale; S6 is a BLS output table, not an ABA pricing source."
    },
    {
      "source_id": "S7",
      "reachable": true,
      "support": "supported",
      "note": "AP reports the Census-attributed statistic that about 51% of small-business owners are over 55 and explicitly distinguishes family or internal succession, sale to an outsider, and winding down."
    }
  ],
  "material_findings": [],
  "caveats": [
    "The q rationale misattributes an ABA/client-pressure claim to S6, which is a BLS industry-output table. S5 still supports the stated 40% alternative-fee-arrangement expectation, q is already labeled ESTIMATE, and correcting the citation claim would not change the base tier or the VALIDATE_ASSUMPTIONS action.",
    "The narrowed specialist-support lens is coherent and explicitly disclosed, but public data do not measure the eligible share of 541199 firms; e=0.50 and the resulting F factor therefore remain judgmental despite the honest ESTIMATE label and broad range.",
    "The task-share, implementation, transfer, retention, and operator-retention bases are not directly observed for independent specialist paralegal and patent-agent providers. Their ESTIMATE labels, caveats, change-evidence statements, MODEL_CONDITIONED readiness, and LOW_PRIORITY-to-PRIORITY interval appropriately expose that limitation.",
    "ABA duties directly govern lawyers, and USPTO registration directly covers the patent-agent portion of the lens; extrapolating those accountability constraints to the full retained paralegal workflow is directionally plausible but not measured."
  ],
  "summary": "Mechanics pass and all seven cited sources were reopened. The disclosed narrowing is coherent, factor semantics are not reversed or double counted, ranges are broad enough to reflect the limited evidence, and the PRIORITY conclusion is presented as model-conditioned rather than substantiated. One citation mismatch and substantial disclosed proxy/estimate dependence warrant publication with caveats, but no defect meets the literal materiality test for rejection."
}
