{
  "run_id": "531210-a1-20260722",
  "naics": "531210",
  "reviewer_model_id": "gpt-5.6-sol",
  "review_date": "2026-07-22",
  "methodology_version": "5.0",
  "outcome": "publishable_with_caveats",
  "mechanics": {
    "identity_ok": true,
    "score_reproduces": true,
    "memo_reproduces": true,
    "artifacts_sha256": "07d6096ce85692daebc60b64f5bb4224e78c7d340643b6185e9d99f0bfe59b68"
  },
  "sources_audited": [
    {
      "source_id": "S1",
      "reachable": true,
      "support": "partially_supported",
      "note": "BLS supports the stated duties, 54% self-employment share, licensing and in-person work, and 3% national 2024-2034 occupational growth. It does not directly measure wage-weighted task substitutability or five-year constant-quality NAICS 531210 service demand, as the packet discloses."
    },
    {
      "source_id": "S2",
      "reachable": true,
      "support": "partially_supported",
      "note": "The September 2025 NAR release supports the stated REALTOR-member AI-use frequencies, 46% AI-content use, and reported business-impact shares. It does not measure labor removal, task exposure, or LMM brokerage implementation, matching the disclosed proxy bridge."
    },
    {
      "source_id": "S3",
      "reachable": true,
      "support": "partially_supported",
      "note": "The 2025 firm profile supports the cited broker-owner, single-office, independent-firm, operating-tenure, competition, and technology-provision facts. Its 4,672 responses represent NAR-member executives and senior managers, with a 2.2% response rate, rather than the frozen $1-10M EBITDA subset; it does not directly establish eligibility, transfer probability, or retention."
    },
    {
      "source_id": "S4",
      "reachable": true,
      "support": "partially_supported",
      "note": "The November 2025 NAR article supports 88% buyer and 91% seller agent use and the stated desired services. It covers recent primary-residence buyers and sellers, not all NAICS 531210 activity or future operator-required service quantity, as the packet acknowledges."
    },
    {
      "source_id": "S5",
      "reachable": true,
      "support": "partially_supported",
      "note": "The NAR settlement page supports written buyer agreements, explicit compensation disclosure, removal of compensation offers from MLS platforms, and full negotiability. It does not quantify the share of AI benefit a brokerage can retain, which is honestly labeled an estimate."
    }
  ],
  "material_findings": [],
  "caveats": [
    "The central labor-opportunity inputs combine an occupational duty description and REALTOR-member AI adoption rather than wage-weighted task exposure or measured labor removal at LMM brokerages; the PROXY labels, bridges, and wide H range disclose this limitation.",
    "The all-firm NAR profile is a weak bridge to the estimated 100-499-employee-derived LMM population: single-office prevalence and independence do not directly identify $1-10M EBITDA lens eligibility or qualifying transfers, and the survey's 2.2% response rate adds selection risk.",
    "The included residential, commercial, and rental activities are economically heterogeneous while the operator-durability evidence is residential-consumer-heavy; the packet discloses the population mismatch but marks the lens non-heterogeneous.",
    "The q base reaches the C-factor cap without direct retention evidence. This remains an honest estimate and does not change the LOW_PRIORITY base tier or VALIDATE_ASSUMPTIONS action under a plausible evidence-state downgrade, so it is not material under the frozen test.",
    "Employment growth and current agent use are broad proxies for future constant-quality demand and operator requirement, but their direction, error channels, and population limitations are explicitly stated."
  ],
  "summary": "Mechanics pass. The record is useful and internally coherent: evidence states are conservative, proxy bridges name the relevant population and construct gaps, ranges are broad enough to expose uncertainty, and the narrative follows the evidence. Every score-driving source is reachable and supports its cited factual premise, but none directly observes the exact LMM primitives. These are disclosed caveats rather than material defects because correcting the evidence classifications would not change the LOW_PRIORITY base tier or the MODEL_CONDITIONED/VALIDATE_ASSUMPTIONS action."
}
